Name,Params,Price,Category,KPGZ Code,KPGZ,SPGZ Code,SPGZ
"Чайник электрический; Объем 1.00000; Электронное; 120.00000 мeс; 245.00000 мм; 150.00000 мм; 2,400.00000; 210.00000 мм","['Мощность', 'Объем', 'Индикатор уровня воды', 'Подсветка ', 'Ширина', 'Вес', 'Высота', 'Глубина', 'Вид нагревательного элемента', 'Длина шнура', 'Функция автоматического отключения при отсутствии воды', 'Функция автоматического отключения при закипании воды', 'Фильтр от накипи', 'Звуковой сигнал при закипании', 'Индикатор включения', 'Чашки в комплекте', 'Вращение на 360°']",NULL,Электрочайники бытовые,01.20.01.03.01.01,ЭЛЕКТРОЧАЙНИКИ БЫТОВЫЕ,NULL,NULL
"Кофемашина DELONGHI ECAM 22.110.B, 1450 Вт, объем 1,8 л, емкость для зерен 250 г, ручной капучинатор, черная","['Объем резервуара для воды', 'Давление', 'Регулировка степени помола', 'Возможность подключения к водопроводу', 'Встроенная кофемолка', 'Подогрев чашек', 'Комплектация', 'Материал жерновов', 'Мощность', 'Высота', 'Глубина', 'Ширина', 'Емкость резервуара для зерен', 'Емкость для молока', 'Вес', 'Регулировка температуры кофе', 'Используемый кофе', 'Съемный лоток для сбора капель', 'Одновременное приготовление двух чашек', 'Тип нагревателя', 'Регулировка крепости кофе', 'Регулируемый по высоте дозатор', 'Автоматическая программа очистки от накипи', 'Дисплей', 'Bluetooth встроенный', 'Автоматическая программа очистки от кофейного жира', 'Подача горячей воды', 'Капучинатор', 'Масса']",NULL,Электрокофеварки бытовые,01.20.01.03.02,ЭЛЕКТРОКОФЕВАРКИ БЫТОВЫЕ,NULL,NULL
Папка-уголок,['NULL'],168.00,Папки пластиковые,01.15.03.17.05,ПАПКИ ПЛАСТИКОВЫЕ,NULL,NULL
Кресло офисное Бюрократ CH-868AXSN экокожа черное,"['Максимальная нагрузка', 'Цвет', 'Материал обивки', 'Тип механизма качания', 'Сетчатая спинка', 'Крестовина  и подлокотники', 'Подлокотники', 'Требует сборки', 'Ширина', 'Максимальная высота', 'Минимальная высота до сиденья', 'Сиденье глубина', 'Масса', 'Сиденье ширина', 'Спинка высота', 'Спинка ширина', 'Максимальная высота сиденья', 'Минимальная высота кресла ']",NULL,Кресла офисные,01.16.04.01,КРЕСЛА ОФИСНЫЕ,NULL,NULL
"Холодильник INDESIT TT 85.005, общий объем 122 л, морозильная камера 14 л, 60x62x85 см, цвет дерево","['Антибактериальное покрытие', 'Второй компрессор', 'Глубина', 'Количество отделений в морозильной камере', 'Количество полок в холодильном отделении', 'Вес', 'Объем морозильной камеры', 'Объем холодильной камеры', 'Перевешиваемые двери', 'Хладогент']",NULL,Холодильники бытовые,01.20.01.04.01,ХОЛОДИЛЬНИКИ БЫТОВЫЕ,NULL,NULL
"Холодильник INDESIT ST 167, общий объем 300 л, верхняя морозильная камера 53 л, 60x66,5x167 см, белый","['Уровень шума', 'Количество камер в холодильнике', 'Количество отделений в морозильной камере', 'Хладогент', 'Глубина', 'Вес', 'Объем морозильной камеры', 'Объем холодильной камеры', 'Общий объем холодильника', 'Инверторный тип холодильника', 'Наличие системы размораживания', 'Наличие системы размораживания', 'Количество полок в холодильном отделении', 'Перевешиваемые двери', 'Антибактериальное покрытие', 'Второй компрессор', 'Тип товара']",NULL,Холодильники бытовые,01.20.01.04.01,ХОЛОДИЛЬНИКИ БЫТОВЫЕ,NULL,NULL
"Сейф мебельный Сейф (к1) VALBERG ASM-120TEL мебельный, эл.замок","['Серия', 'Гарантийный срок', 'Тип замка', 'Высота', 'Наличие в салоне', 'Ширина', 'Глубина', 'Ценовая категория', 'Наименование модели', 'Возможность крепления к полу или стене', 'С трейзером', 'С аварийным ключом', 'Типоразмер сейфа', 'Внутренние размеры', 'В собранном виде', 'Количество полок', 'Цвет']",NULL,Сейфы прочие,01.16.17.02,СЕЙФЫ ПРОЧИЕ,NULL,NULL
"Сейф офисный VALBERG ""ASM-63T EL"", 630х440х355 мм, электронный замок, трейзер","['Защита замка от высверливания', 'Класс взломостойкости сейфа', 'Количество полок', 'Масса', 'Наличие трейзера', 'Предусмотрена возможность анкерного крепления к полу и стене', 'Размеры', 'Тип замка', 'Толщина боковых стенок', 'Толщина лицевой панели', 'Цвет', 'Толщина задней стенки']",31334.25,Сейфы прочие,01.16.17.02,СЕЙФЫ ПРОЧИЕ,NULL,NULL
"Батарейки КОМПЛЕКТ 4 шт., SONNEN Alkaline, АА (LR6, 15А), алкалиновые, пальчиковые, блистер","['Количество в упаковке', 'Напряжение номинальное', 'Упаковка', 'Тип электролита элемента питания', 'Размер элемента питания', 'Форма элемента питания', 'Вес']",135.92,Батареи аккумуляторные литиевые и щелочные,01.10.04.03.09,БАТАРЕИ АККУМУЛЯТОРНЫЕ ЛИТИЕВЫЕ И ЩЕЛОЧНЫЕ,NULL,NULL
"Сетевой фильтр DEFENDER ES, 5 розеток, 5 м, белый","['Usb разъем', 'Вес', 'Высота', 'Длина кабеля', 'Длина шнура', 'Защита', 'Наличие шторок на розетках', 'Индивидуальные выключатели розеток', 'Наличие выключателя на корпусе', 'Цвет', 'Количество розеток', 'Напряжение', 'Максимальная рассеиваемая энергия', 'Материал корпуса', 'Суммарная мощность нагрузки', 'Номинальная частота', 'Ширина', 'Крепление на стену', 'Корпус из негорючего материала', 'Сила тока.']",819.25,Фильтры сетевые,01.13.07.05.13,ФИЛЬТРЫ СЕТЕВЫЕ,3346988,"Оборудование балансировки сетевого траффика, компл"
"Удлинитель в бухте POWER CUBE, 1 розетка с заземлением, 10 м, 3х0,75 мм, 1300 Вт, оранжевый","['Вес', 'Длина', 'Количество розеток', 'Морозостойкий кабель', 'Наличие выключателя', 'Наличие заземления', 'Наличие рамки', 'Рабочее напряжение', 'Степень защиты ', 'Цвет', 'Суммарная мощность нагрузки']",NULL,Удлинители бытового и аналогичного назначения,01.10.04.04.01,УДЛИНИТЕЛИ БЫТОВОГО И АНАЛОГИЧНОГО НАЗНАЧЕНИЯ,3346988,"Оборудование балансировки сетевого траффика, компл"
"Удлинитель РАДИСТ ПРЕМИУМ Р16-012, 3 розетки с заземлением, 7 м, 3х0,75 мм, 1300 Вт, белый","['Вес', 'Длина', 'Количество розеток', 'Мощность', 'Наличие заземления']",NULL,Удлинители бытового и аналогичного назначения,01.10.04.04.01,УДЛИНИТЕЛИ БЫТОВОГО И АНАЛОГИЧНОГО НАЗНАЧЕНИЯ,3346988,"Оборудование балансировки сетевого траффика, компл"
"Сетевой фильтр SONNEN U-353, 5 розеток, с заземлением, выключатель, защита от перегрузок, 10 А, 3 м","['Usb разъем', 'Вес', 'Длина кабеля', 'Защита', 'Наличие шторок на розетках', 'Индивидуальные выключатели розеток', 'Наличие выключателя на корпусе', 'Количество розеток', 'Корпус из негорючего материала', 'Цвет', 'Напряжение', 'Материал корпуса', 'Суммарная мощность нагрузки', 'Номинальная частота', 'Крепление на стену']",616.59,Фильтры сетевые,01.13.07.05.13,ФИЛЬТРЫ СЕТЕВЫЕ,3346988,"Оборудование балансировки сетевого траффика, компл"
Батарейка алкалиновая SONNEN 23АЕ 12В 1 шт.,"['Количество в упаковке', 'Номинальное напряжение', 'Упаковка', 'Тип электролита элемента питания', 'Размер элемента питания', 'Форма элемента питания', 'Вес']",69.15,Элементы питания (батарейки),01.10.04.02,ЭЛЕМЕНТЫ ПИТАНИЯ (БАТАРЕЙКИ),NULL,NULL
"Батарейка алкалиновая SONNEN AAA 1,5В 4 шт.","['Количество в упаковке', 'Номинальное напряжение', 'Упаковка', 'Тип электролита элемента питания', 'Размер элемента питания', 'Форма элемента питания', 'Вес']",NULL,Элементы питания (батарейки),01.10.04.02,ЭЛЕМЕНТЫ ПИТАНИЯ (БАТАРЕЙКИ),NULL,NULL
Настенный кронштейн Digis DSM-8043,['NULL'],NULL,Крепления,01.08.01.19,ОБОРУДОВАНИЕ И ИНВЕНТАРЬ ДЛЯ ЛЫЖНОГО СПОРТА,NULL,NULL
Выполнение работ по изготовлению полиграфической продукции (журналов и бухгалтерских книг).,['NULL'],NULL,Печатные работы....,02.17.04.04.99,РАБОТЫ ПЕЧАТНЫЕ ПРОЧИЕ,NULL,NULL
Перевозка грузов до 3 т.,"['Погрузка/разгрузка', 'Предельная масса груза', 'Предельный объём груза', 'Предельная длина груза']",890.00,Перевозка (доставка) грузов прочая,03.32.06,ПЕРЕВОЗКА (ДОСТАВКА) ГРУЗОВ ПРОЧАЯ,NULL,NULL
Пурифайер WFP-2200,"['Вес', 'Вид техники бытовой', 'Вид мелкой бытовой техники', 'Вид продукции', 'Вид товаров', 'Защита от детей', 'Количество кранов подачи воды', 'Объем бака горячей воды', 'Объем бака холодной воды', 'Цвет корпуса', 'Тип охлаждения воды', 'Мощность нагрева', 'Цвет вставки', 'Ступени очистки', 'Система  фильтрации']",NULL,Пурифайер...,01.20.01.05.02,ПУРИФАЙЕРЫ,NULL,NULL
Охранные услуги,"['Физическая охрана', 'Осуществление контрольно-пропускного режима', 'Охрана периметра', 'Охрана материальных ценностей', 'Выставление поста охраны']",NULL,Услуги частной охраны (выставление поста охраны),03.10.01.01,УСЛУГИ ЧАСТНОЙ ОХРАНЫ (ВЫСТАВЛЕНИЕ ПОСТА ОХРАНЫ),NULL,NULL
"Шкаф для ключей Сейф Onix К-48 Шкаф для 48 ключ.,240х80х300","['Тип замка', 'Возможность крепления к стене', 'Гарантийный срок', 'Вес', 'Материал корпуса', 'Высота', 'Наличие в салоне', 'Дверь (со стеклом/металлическая)', 'Количество мест для ключей', 'Глубина', 'Ширина', 'Артикул']",NULL,Шкафы хозяйственные металлические,01.16.07.01.06,ШКАФЫ ХОЗЯЙСТВЕННЫЕ МЕТАЛЛИЧЕСКИЕ,NULL,NULL
Перевозка грузов до 3 т.,"['Погрузка/разгрузка', 'Предельная масса груза', 'Предельный объём груза', 'Предельная длина груза']",890.00,Перевозка (доставка) грузов прочая,03.32.06,ПЕРЕВОЗКА (ДОСТАВКА) ГРУЗОВ ПРОЧАЯ,NULL,NULL
"Бумага цветная IQ COLOR (А4,80г,5цв. 39,40,44,42,48 по 50л.) пачка 250л.","['Плотность бумаги', 'Формат', 'Количество листов в пачке', 'Схема вложения', 'Интенсивность цвета', 'Цвет']",NULL,Бумага для офисной техники,01.15.01.01.01,БУМАГА ДЛЯ ОФИСНОЙ ТЕХНИКИ,NULL,NULL
"Средство чистящее для техники Rexant Cleaner 0,4 л","['Назначение средства', 'Объем флакона', 'Тип распылителя', 'Артикул']",NULL,Средства чистящие универсального назначения,01.20.04.01.13,СРЕДСТВА ЧИСТЯЩИЕ УНИВЕРСАЛЬНОГО НАЗНАЧЕНИЯ,NULL,NULL
Салфетка хозяйственная ЧУДО ТРЯПКА универсальная 25х23см 33 листа,"['Страна производитель', 'Схема вложения', 'Назначение салфеток', 'Материал салфеток', 'Плотность материала']",995.23,"Салфетки, насадки для уборки, полотна технические, ветошь",01.20.03.04.05.02,"САЛФЕТКИ, НАСАДКИ ДЛЯ УБОРКИ, ПОЛОТНА ТЕХНИЧЕСКИЕ, ВЕТОШЬ",NULL,NULL
"Салфетки Attache Selection Smart Price для экранов, туба, 100 штук, 110х160 мм","['Антибактериальный ', 'Количество штук в упаковке', 'Материал салфеток', 'Назначение салфеток', 'Отдушка', 'Размер салфетки', 'Тип']",NULL,Средства чистящие для бытовой техники,01.20.04.01.09,СРЕДСТВА ЧИСТЯЩИЕ ДЛЯ БЫТОВОЙ ТЕХНИКИ,NULL,NULL
Папка файловая на 100 файлов Attache Fantasy зеленый,"['Цвет', 'Вид материала', 'Количество в упаковке', 'Формат', 'Толщина материала', 'Ширина корешка', 'Наличие кармана на лицевой обложке папки', 'Количество файлов в папке']",NULL,Папки пластиковые,01.15.03.17.05,ПАПКИ ПЛАСТИКОВЫЕ,NULL,NULL
Клейкая лента упаковочная Комус 50мм х 100м 50мкм прозрачная,"['Цвет', 'Количество в упаковке', 'Количество упаковок в коробе', 'Длина намотки', 'Ширина, мм', 'Функциональное назначение', 'Длина (м)', 'Дополнительные свойства', 'Толщина (мкм)', 'Логотип', 'Вес упаковываемого груза (кг)']",NULL,Лента клейкая упаковочная,01.20.07.11.08,ЛЕНТА КЛЕЙКАЯ УПАКОВОЧНАЯ,NULL,NULL
Средство чистящее от скотча ХИМИТЕК АНТИСТИКЕР 0.4 л,"['Вес', 'Страна производства', 'Назначение средства', 'Срок годности', 'Гост/ту', 'Концентрат', 'Область применения', 'Консистенция', 'Степень пенности', 'Тип профессиональной химии', 'Показатель ph 1% раствора']",672.91,Средства чистящие универсального назначения,01.20.04.01.13,СРЕДСТВА ЧИСТЯЩИЕ УНИВЕРСАЛЬНОГО НАЗНАЧЕНИЯ,NULL,NULL
Файл-вкладыш Attache А4 30мкм,"['Вид', 'Вместимость', 'Количество в упаковке', 'Количество упаковок в коробе', 'Материал', 'Назначение файла-вкладыша', 'Перфорация', 'Размер', 'С расширением', 'Цвет', 'Фактура', 'Формат', 'Толщина', 'Формат папки ориентирован']",259.58,Файлы-вкладыши пластиковые,01.15.03.17.06,ФАЙЛЫ-ВКЛАДЫШИ ПЛАСТИКОВЫЕ,24484678,Файл-вкладыш
Оказание услуг по проведению технической экспертизы с выдачей актов технической экспертизы вычислительного и телекоммуникационного оборудования на каждую единицу техники (вычислительного и телекоммуникационного оборудования),"['Диагностика', 'Выдача заключения', 'Вид услуги по оценке', 'Основание', 'Согласование с заказчиком работ, при необходимости устранение замечаний заказчика']",NULL,Экспертиза технического состояния,03.30.01.02,ЭКСПЕРТИЗА ТЕХНИЧЕСКОГО СОСТОЯНИЯ,NULL,NULL
"Разработка логотипа, фирменного стиля и Руководства по использованию фирменного стиля","['Логотип', 'Фирменные цвета', 'Фирменная графика', 'Примеры оформления носителей фирменного стиля', 'Миссия бренда', 'Принципы размещения логотипа', 'Размеры и охранное поле логотипа']",NULL,Услуги консалтинговые прочие,03.22.99,УСЛУГИ КОНСАЛТИНГОВЫЕ ПРОЧИЕ,NULL,NULL
Охранные услуги,"['Физическая охрана', 'Осуществление контрольно-пропускного режима', 'Охрана периметра', 'Охрана материальных ценностей', 'Выставление поста охраны']",NULL,Услуги частной охраны (выставление поста охраны),03.10.01.01,УСЛУГИ ЧАСТНОЙ ОХРАНЫ (ВЫСТАВЛЕНИЕ ПОСТА ОХРАНЫ),NULL,NULL
"Мешки для мусора 180л, ВД, 90х110см, 50шт/рул.","['Объем', 'Вес', 'Страна производства', 'Артикул', 'Количество в упаковке', 'Плотность', 'Цвет', 'Тип упаковки', 'Наличие ручек/завязок', 'Длина, см', 'Ширина, см', 'Высота ведра не более, см', 'Ароматизированные', 'Количество рулонов в транспортной коробке', 'Биоразлагаемые', 'Круглое ведро: верхний диаметр не более, см', 'Круглое ведро: объем не более, л', 'Прямоугольное ведро: объем не более']",NULL,Мешки полимерные,01.20.07.11.03.01.02,МЕШКИ ПОЛИМЕРНЫЕ,NULL,NULL
Набор для чистки оргтехники ProМEGA Оffice LCD/TFT спрей 500мл микрофибра,"['Антибактериальный ', 'Материал салфеток', 'Назначение средства', 'Объем', 'Отдушка', 'Размер салфетки', 'Распылитель', 'Салфетка в комплекте']",NULL,Средства чистящие для бытовой техники,01.20.04.01.09,СРЕДСТВА ЧИСТЯЩИЕ ДЛЯ БЫТОВОЙ ТЕХНИКИ,NULL,NULL
Полотенца бумажные д/держ.VeiroA1/A2 Premium 2сл.160м 6рул K304,"['Рисунок', 'Схема вложения', 'Количество слоев', 'Цвет бумаги', 'Плотность материала', 'Тиснение', 'Размер листа', 'Для диспенсеров', 'Система Tork', 'Количество в упаковке', 'Тип полотенец', 'Перфорация', 'Длина рулона', 'Количество листов в пачке/рулоне', 'Сырье', 'Тип сложения']",NULL,Полотенца бумажные,01.20.05.03.04.02,ПОЛОТЕНЦА БУМАЖНЫЕ,NULL,NULL
Подписка на  периодические печатные издания,"['Периодичность', 'Формат', 'Язык издания', 'Страна производитель']",9267.36,Обеспечение периодическими изданиями,03.12.05.04,ОБЕСПЕЧЕНИЕ ПЕРИОДИЧЕСКИМИ ИЗДАНИЯМИ,NULL,NULL
Аренда автомобиля с водителем,"['Аренда автомобиля с водителем', 'Категория в', 'Наличие кондиционера', 'Эконом класс']",NULL,Аренда автомобилей легковых с водителем,03.31.03.01.01,АРЕНДА АВТОМОБИЛЕЙ ЛЕГКОВЫХ С ВОДИТЕЛЕМ,NULL,NULL
Аренда автомобиля с водителем,"['Аренда автомобиля с водителем', 'Категория в', 'Наличие кондиционера', 'Эконом класс']",NULL,Аренда автомобилей легковых с водителем,03.31.03.01.01,АРЕНДА АВТОМОБИЛЕЙ ЛЕГКОВЫХ С ВОДИТЕЛЕМ,NULL,NULL
Семинары по важнейшим изменениям в области бухгалтерского учёта из первых уст ведущих лекторов Минфина России.,"['Предоставление консультационных услуг', 'Предоставление печатной версии программы', 'Наименование мероприятия', 'Вид консультирования', 'Цель обучения', 'Результат обучения', 'Категория слушателей', 'Отрасль', 'Предоставление методических пособий']",NULL,Иные учебные мероприятия,03.03.99,ИНЫЕ УЧЕБНЫЕ МЕРОПРИЯТИЯ,NULL,NULL
"Вывоз и утилизация медицинского оборудования, усл. ед","['Наличие лицензии', 'Сбор отходов', 'Транспортировка отходов', 'Вывоз отходов осуществляется спецтранспортом исполнителя']",NULL,Услуги по обращению с прочими отходами,03.08.03.01.02.99,УСЛУГИ ПО ОБРАЩЕНИЮ С ПРОЧИМИ ОТХОДАМИ,NULL,NULL
