Name,Params,Price,Category,KPGZ Code,KPGZ,SPGZ Code,SPGZ
Инженер Linux систем,"['Вид обучения', 'Категория обучающихся', 'Объем образовательной программы', 'Предоставление помещения для обучения Исполнителем', 'Применение дистанционных технологий обучения', 'Применение электронного обучения', 'Требование к месту проведения обучения', 'Требование к месту проведения обучения', 'Форма обучения', 'Вид продукции', 'Вид услуги', 'Вид образовательных, научных услуг', 'Виды профессионального образования по дополнительным профессиональным образовательным программам']",197490.00,Профессиональная переподготовка,03.03.14.02,ПРОФЕССИОНАЛЬНАЯ ПЕРЕПОДГОТОВКА,NULL,NULL
Изготовление кармана для пропуска с логотипом,"['Внешний размер изделия', 'Материал', 'Согласование макета с заказчиком', 'Способ нанесения логотипа', 'Цвет', 'Вид продукции', 'Виды работ по изготовлению', 'Виды изготовления сувенирной продукции', 'Изготовление макета поставщиком', 'Ориентация', 'Покрытие экокожи', 'Размер вкладыша', 'Количество секций']",NULL,Изготовление канцелярской сувенирной продукции,02.17.10.05,ИЗГОТОВЛЕНИЕ КАНЦЕЛЯРСКОЙ СУВЕНИРНОЙ ПРОДУКЦИИ,NULL,NULL
Изготовление ленты для бейджа,"['Изготовление макета поставщиком', 'Материал ленты', 'Печать', 'Согласование макета с заказчиком', 'Способ нанесения логотипа', 'Цвет', 'Цвет печати', 'Ширина ленты', 'Способ крепления бейджа к ленте', 'Материал карабина']",NULL,Изготовление текстильной сувенирной продукции,02.17.10.02,ИЗГОТОВЛЕНИЕ ТЕКСТИЛЬНОЙ СУВЕНИРНОЙ ПРОДУКЦИИ,49114960,Изготовление альбома
Изготовление календаря квартального с логотипом,"['Бумага блока', 'Изготовление макета поставщиком', 'Количество пружин', 'Ламинация', 'Материал подложки', 'Плотность бумаги блока, г/м2', 'Плотность материала подложки', 'Размер блока', 'Согласование макета с заказчиком', 'Вид продукции', 'Виды работ по изготовлению', 'Виды работ по изготовлению полиграфической и печатной продукции', 'Формат календаря']",NULL,Работы по изготовлению полиграфической продукции...,02.17.04.08,РАБОТЫ ПО ИЗГОТОВЛЕНИЮ ПОЛИГРАФИЧЕСКОЙ ПРОДУКЦИИ,457000645,Изготовление газеты
Изготовление ручки с логотипом,"['Вид ручки', 'Диаметр шарика ', 'Изготовление макета поставщиком', 'Материал клипа', 'Материал корпуса', 'Материал наконечника', 'Размер', 'Ручка автоматическая', 'Согласование макета с заказчиком', 'Цвет корпуса', 'Толщина линии письма', 'Тип механизма ручки', 'Форма корпуса', 'Способ нанесения логотипа', 'Цвет чернил', 'Форма наконечника']",NULL,Изготовление канцелярской сувенирной продукции,02.17.10.05,ИЗГОТОВЛЕНИЕ КАНЦЕЛЯРСКОЙ СУВЕНИРНОЙ ПРОДУКЦИИ,NULL,NULL
"Изготовление ежедневника А5 с логотипом, темно-серый","['Вид', 'Дополнительная информация', 'Изготовление макета поставщиком', 'Количество страниц', 'Материал', 'Переплет', 'Плотность бумаги блока', 'Размер', 'Согласование макета с заказчиком', 'Вид продукции', 'Виды работ по изготовлению', 'Виды работ по изготовлению полиграфической и печатной продукции', 'Формат', 'Цвет', 'Цвет фольги', 'Цвет бумаги на блок', 'Способ нанесения персонализации']",NULL,Работы по изготовлению полиграфической продукции...,02.17.04.08,РАБОТЫ ПО ИЗГОТОВЛЕНИЮ ПОЛИГРАФИЧЕСКОЙ ПРОДУКЦИИ,457000645,Изготовление газеты
Изготовление ежедневника А4 с твердой обложкой и логотипом,"['Вес', 'Вид', 'Изготовление макета поставщиком', 'Количество страниц', 'Материал', 'Плотность бумаги блока', 'Размер', 'Согласование макета с заказчиком', 'Способ нанесения персонализации', 'Вид продукции', 'Виды работ по изготовлению', 'Виды работ по изготовлению полиграфической и печатной продукции', 'Формат', 'Цвет бумаги', 'Цвет ляссе', 'Цвет обложки', 'Цвет обреза', 'Крепление блока']",NULL,Работы по изготовлению полиграфической продукции...,02.17.04.08,РАБОТЫ ПО ИЗГОТОВЛЕНИЮ ПОЛИГРАФИЧЕСКОЙ ПРОДУКЦИИ,457000645,Изготовление газеты
"Изготовление ежедневника А5 с логотипом, красный","['Вид', 'Дополнительная информация', 'Изготовление макета поставщиком', 'Количество страниц', 'Материал', 'Переплет', 'Плотность бумаги блока', 'Размер', 'Согласование макета с заказчиком', 'Вид продукции', 'Виды работ по изготовлению', 'Виды работ по изготовлению полиграфической и печатной продукции', 'Формат', 'Цвет', 'Цвет фольги', 'Цвет бумаги на блок', 'Способ нанесения персонализации']",NULL,Работы по изготовлению полиграфической продукции...,02.17.04.08,РАБОТЫ ПО ИЗГОТОВЛЕНИЮ ПОЛИГРАФИЧЕСКОЙ ПРОДУКЦИИ,457000645,Изготовление газеты
"Изготовление настольного перекидного календаря ""домик""","['Вид', 'Изготовление макета поставщиком', 'Материал', 'Размер', 'Согласование макета с заказчиком', 'Цвет', 'Способ нанесения логотипа', 'Виды работ по изготовлению', 'Виды работ по изготовлению полиграфической и печатной продукции']",NULL,Работы по изготовлению полиграфической продукции...,02.17.04.08,РАБОТЫ ПО ИЗГОТОВЛЕНИЮ ПОЛИГРАФИЧЕСКОЙ ПРОДУКЦИИ,457000645,Изготовление газеты
"Обучение по программе профессиональной переподготовки ""UX/UI-дизайнер. Разработка веб-интерфейсов с использованием Figma 2.0""","['Вид обучения', 'Выдаваемый документ по окончании обучения', 'Наличие лицензии на право осуществления образовательной деятельности', 'Форма обучения', 'Вид продукции', 'Вид услуги', 'Вид образовательных, научных услуг', 'Виды профессионального образования по дополнительным профессиональным образовательным программам', 'Продолжительность обучения']",NULL,Профессиональная переподготовка,03.03.14.02,ПРОФЕССИОНАЛЬНАЯ ПЕРЕПОДГОТОВКА,NULL,NULL
Перманентный быстросохнущий маркер для маркировки BRADY BFS-10 brd335092 черный,"['Материал поверхности', 'Назначение', 'Тип маркера', 'Толщина линии письма', 'Форма наконечника', 'Цвет чернил']",NULL,Маркеры,01.15.04.02.04,МАРКЕРЫ,NULL,NULL
"Стяжка нейлоновая неоткрывающаяся Cabeus GTOUT-370, безгалогенная (halogen free), 370x3.6мм, черная  (100 шт)","['Безгалогенность', 'Длина', 'Количество в упаковке', 'Материал', 'Температура эксплуатации', 'Цвет', 'Ширина', 'Вид продукции', 'Виды товаров строительных', 'Виды материалов расходных инженерно-строительных', 'Виды металлов и металлоизделий', 'Виды метизов, крепежных изделий']",NULL,"Метизы, крепежные изделия прочие",01.11.03.01.01.99,"МЕТИЗЫ, КРЕПЕЖНЫЕ ИЗДЕЛИЯ ПРОЧИЕ",558694,"Саморез со сверлом 4,2х32, полусфера, цинк, с пресшайбой, 850шт/упак, упак"
Хомут-липучка черный 150х15 мм Hyperline WASN-150-BK-10,"['Длина', 'Количество в упаковке', 'Материал', 'Назначение', 'Тип', 'Фиксация', 'Цвет', 'Ширина', 'Вид продукции', 'Виды товаров строительных', 'Виды материалов расходных инженерно-строительных', 'Виды металлов и металлоизделий', 'Виды метизов, крепежных изделий']",NULL,"Метизы, крепежные изделия прочие",01.11.03.01.01.99,"МЕТИЗЫ, КРЕПЕЖНЫЕ ИЗДЕЛИЯ ПРОЧИЕ",558694,"Саморез со сверлом 4,2х32, полусфера, цинк, с пресшайбой, 850шт/упак, упак"
"Хомут для кабеля Hyperline WAS-210-GN, липучка с мягкой застежкой,210x14 мм, зеленый","['Длина', 'Материал', 'Назначение', 'Тип', 'Фиксация', 'Цвет', 'Ширина', 'Вид продукции', 'Виды товаров строительных', 'Виды материалов расходных инженерно-строительных', 'Виды металлов и металлоизделий', 'Виды метизов, крепежных изделий']",NULL,"Метизы, крепежные изделия прочие",01.11.03.01.01.99,"МЕТИЗЫ, КРЕПЕЖНЫЕ ИЗДЕЛИЯ ПРОЧИЕ",558694,"Саморез со сверлом 4,2х32, полусфера, цинк, с пресшайбой, 850шт/упак, упак"
"Hyperline GT-200IC Стяжка нейлоновая неоткрывающаяся, безгалогенная (halogen free), 200x3.6 мм, полиамид 6.6, -40°C - +85°C (100 шт)","['Длина', 'Количество в упаковке', 'Материал', 'Температура эксплуатации', 'Цвет', 'Ширина', 'Безгалогенность']",NULL,"Метизы, крепежные изделия прочие",01.11.03.01.01.99,"МЕТИЗЫ, КРЕПЕЖНЫЕ ИЗДЕЛИЯ ПРОЧИЕ",NULL,NULL
"Чистящие салфетки DEFENDER CLN30102, влажные, для ЖК и LCD мониторов, в тубе, 100 шт.","['Антибактериальный эффект', 'Количество  салфеток', 'Материал салфеток', 'Назначение', 'Наличие антистатического компонента', 'Плотность материала', 'Размер салфетки', 'Тип', 'Упаковка']",NULL,Средства чистящие для бытовой техники,01.20.04.01.09,СРЕДСТВА ЧИСТЯЩИЕ ДЛЯ БЫТОВОЙ ТЕХНИКИ,NULL,NULL
"Средство чистящее для техники Defender CLN 30805 Optima 0,4 л","['Вес', 'Объем', 'Состав', 'Срок годности']",NULL,Средства чистящие универсального назначения,01.20.04.01.13,СРЕДСТВА ЧИСТЯЩИЕ УНИВЕРСАЛЬНОГО НАЗНАЧЕНИЯ,NULL,NULL
"Пленка воздушно-пузырчатая 2-слойная, ширина 0,5 м, длина 20 м","['Длина', 'Пленка пищевая', 'Плотность', 'Тип пленки', 'Цвет пленки', 'Ширина', 'Вид продукции', 'Виды хозяйственных товаров', 'Вид принадлежностей и инвентаря бытового', 'Виды тары и упаковки бытовой', 'Количество слоев']",NULL,Пленка упаковочная,01.20.07.11.01,ПЛЕНКА УПАКОВОЧНАЯ,10549816,Пленка упаковочная воздушно-пузырчатая
"Клейкая лента упаковочная Unibob, 48мм*66м, 47мкм","['Длина намотки', 'Надпись на ленте', 'Толщина ленты', 'Упаковочная', 'Ширина клейкой ленты', 'Цвет', 'Вид товаров', 'Виды хозяйственных товаров', 'Вид принадлежностей и инвентаря бытового', 'Виды тары и упаковки бытовой']",NULL,Лента клейкая упаковочная,01.20.07.11.08,ЛЕНТА КЛЕЙКАЯ УПАКОВОЧНАЯ,NULL,NULL
"Салфетка для стекол, зеркал, оптики ОФИСМАГ, плотная микрофибра, 30х30 см, фиолетовая","['Применение', 'Количество в упаковке', 'Цвет', 'Длина', 'Упаковка', 'Вид материала', 'Вес изделия', 'Тип', 'Ширина']",90.61,"Салфетки, насадки для уборки, полотна технические, ветошь",01.20.03.04.05.02,"САЛФЕТКИ, НАСАДКИ ДЛЯ УБОРКИ, ПОЛОТНА ТЕХНИЧЕСКИЕ, ВЕТОШЬ",NULL,NULL
"Средство чистящее для пластика HGP 0,5 л","['Дозатор', 'Объем', 'Отдушка', 'Подходит для поверхностей', 'Профессиональное средство', 'Упаковка', 'Форма выпуска']",NULL,Средства чистящие универсального назначения,01.20.04.01.13,СРЕДСТВА ЧИСТЯЩИЕ УНИВЕРСАЛЬНОГО НАЗНАЧЕНИЯ,NULL,NULL
"Средство чистящее от скотча PRO-BRITE FORMULA X-5 0,3 л","['Дозатор', 'Объем', 'Отдушка', 'Упаковка', 'Форма выпуска', 'Эффект от использования']",576.29,Средства чистящие универсального назначения,01.20.04.01.13,СРЕДСТВА ЧИСТЯЩИЕ УНИВЕРСАЛЬНОГО НАЗНАЧЕНИЯ,NULL,NULL
Стрейч-пленка для ручной упаковки первичное сырье вес брутто 2 кг 20 мкм x 50 см x 217 м,"['Вес брутто :', 'Длина', 'Сырье', 'Толщина пленки', 'Цвет пленки', 'Ширина', 'Вид продукции', 'Виды хозяйственных товаров', 'Вид принадлежностей и инвентаря бытового', 'Виды тары и упаковки бытовой']",887.15,Пленка упаковочная,01.20.07.11.01,ПЛЕНКА УПАКОВОЧНАЯ,NULL,NULL
Салфетка хозяйственная микрофибра с ППУ покрытием 30x30 см зеленая,"['Вид материала', 'Размер', 'Тип салфетки', 'Цвет', 'Плотность', 'Вид товаров', 'Виды хозяйственных товаров', 'Вид салфеток и тряпок']",131.05,"Салфетки, насадки для уборки, полотна технические, ветошь",01.20.03.04.05.02,"САЛФЕТКИ, НАСАДКИ ДЛЯ УБОРКИ, ПОЛОТНА ТЕХНИЧЕСКИЕ, ВЕТОШЬ",NULL,NULL
"Создание презентационных материалов с помощью компьютерных программ «Графики, таблицы, много всего на слайде» посредством предоставления доступа к базе данных Бонни и слайд","['Возможность консультации пользователя', 'Доступ в личный кабинет', 'Информационное обеспечение', 'Место предоставления', 'Место предоставления доступа к информационному ресурсу']",NULL,Дополнительное обучение,03.03.14.05,ДОПОЛНИТЕЛЬНОЕ ОБУЧЕНИЕ,NULL,NULL
Оказание услуг по обучению в области создания презентационных материалов с помощью компьютерных программ «Убойные презентации» посредством предоставления доступа к базе данных «Бонни и слайд»,"['Возможность консультации пользователя', 'Доступ в личный кабинет', 'Информационное обеспечение', 'Место предоставления', 'Место предоставления доступа к информационному ресурсу']",NULL,Дополнительное обучение,03.03.14.05,ДОПОЛНИТЕЛЬНОЕ ОБУЧЕНИЕ,NULL,NULL
"Пакет С4 229х324х40, крафт, с расширением, силиконовая лента,130г 200шт/уп","['Боковое расширение', 'Единица измерения', 'Количество штук в упаковке', 'Материал', 'Наличие окна на конверте', 'Плотность/толщина материала:', 'Размер изделия', 'Расширение боковое', 'Способ заклеивания', 'Вид продукции', 'Вид товаров', 'Виды бумажной продукции', 'Вид конвертов и других изделий почтовых']",NULL,Конверты почтовые,01.15.08.01,КОНВЕРТЫ ПОЧТОВЫЕ,NULL,NULL
"Конверты Е65 (110х220 мм), отрывная лента, 80 г/м2, КОМПЛЕКТ 1000 шт.","['Количество в упаковке', 'Наличие окна на конверте', 'Плотность', 'Способ заклеивания', 'Форма клапана', 'Формат', 'Формат вложения без сложения', 'Цвет', 'Вид продукции', 'Вид товаров', 'Виды бумажной продукции', 'Вид конвертов и других изделий почтовых']",2098.53,Конверты почтовые,01.15.08.01,КОНВЕРТЫ ПОЧТОВЫЕ,NULL,NULL
"Конверт С4 (229х324) , PostFix, белый, силиконовая лента,90гр/м2, 250 шт/упак","['Вид', 'Вид заклеивания', 'Единица измерения', 'Количество  в упаковке', 'Плотность', 'Размер', 'Цвет', 'Вид продукции', 'Вид товаров', 'Виды бумажной продукции', 'Вид конвертов и других изделий почтовых']",NULL,Конверты почтовые,01.15.08.01,КОНВЕРТЫ ПОЧТОВЫЕ,NULL,NULL
"Конверт крафт Е4, 290х390 мм, без клея, треугольный клапан, 80 гр. (500 шт./кор.)","['Количество в упаковке', 'Материал', 'Плотность', 'Размер', 'Тип заклеивания', 'Форма клапана', 'Формат', 'Цвет', 'Вид товаров', 'Виды бумажной продукции']",NULL,Конверты почтовые,01.15.08.01,КОНВЕРТЫ ПОЧТОВЫЕ,NULL,NULL
"Конверты С4 (229-324 мм), отрывная лента, внутренняя запечатка, 100 г/м2, КОМПЛЕКТ 50 шт., BRAUBERG, 112181","['Внутренняя запечатка', 'Количество в упаковке', 'Плотность', 'Способ заклеивания', 'Упаковка', 'Форма клапана', 'Формат', 'Формат вложения без сложения', 'Цвет']",492.37,Конверты почтовые,01.15.08.01,КОНВЕРТЫ ПОЧТОВЫЕ,NULL,NULL
"Твердотельный накопитель Samsung MZ-V7S2T0BW (2TB, M.2)","['Максимальная скорость записи', 'Максимальная скорость чтения', 'Объем буферной памяти', 'Объем накопителя', 'Тип памяти', 'Тип устройства', 'Форм фактор']",NULL,Накопители данных внутренние,01.13.17.17,НАКОПИТЕЛИ ДАННЫХ ВНУТРЕННИЕ,NULL,NULL
"Накопитель твердотельный SSD SAMSUNG 2.5"" 870 QVO 8000 Гб SATA III V-NAND 4bit MLC(QLC) (MZ-77Q8T0BW)","['Вес', 'Максимальная скорость записи', 'Максимальная скорость чтения', 'Объем накопителя', 'Тип памяти', 'Форм-фактор', 'Вид продукции', 'Виды товаров информационно-технологических, средств связи, оргтехники, электроники (включая программное обеспечение)', 'Виды электронных компонентов и комплектующих информационно-технологического оборудования', 'Интерфейс', 'Буферная память']",NULL,Накопители данных внутренние,01.13.17.17,НАКОПИТЕЛИ ДАННЫХ ВНУТРЕННИЕ,NULL,NULL
Внешний жесткий диск Samsung T7 Touсh 2Tb 1.8 USB 3.2 G2 MU-PC2T0H/WW,"['Объем памяти', 'Размеры (дхшхв)', 'Вес', 'Гарантийный срок', 'Интерфейс', 'Интерфейс тип', 'Кабель USB в комплекте', 'Тип', 'Тип питания', 'Цвет', 'Форм-фактор.']",20900.00,Устройства хранения данных дисковые автономные (внешние жесткие диски),01.13.05.01,УСТРОЙСТВА ХРАНЕНИЯ ДАННЫХ ДИСКОВЫЕ АВТОНОМНЫЕ (ВНЕШНИЕ ЖЕСТКИЕ ДИСКИ),NULL,NULL
"Обучение по программе ""Разработка приложений с использованием SPRING и Spring MVC/REST""","['Вид обучения', 'Объем образовательной программы', 'Предоставление помещения для обучения Исполнителем', 'Применение дистанционных технологий обучения', 'Применение электронного обучения', 'Требование к месту проведения обучения', 'Вид продукции', 'Вид услуги', 'Вид образовательных, научных услуг', 'Виды профессионального образования по дополнительным профессиональным образовательным программам']",NULL,Повышение профессиональной квалификации,03.03.14.01,ПОВЫШЕНИЕ ПРОФЕССИОНАЛЬНОЙ КВАЛИФИКАЦИИ,NULL,NULL
