Name,Params,Price,Category,KPGZ Code,KPGZ,SPGZ Code,SPGZ
"Клей-карандаш SCOTCH, 21 г (3М, США)","[' Вес', 'Цвет', 'Назначение', 'Прозрачный', 'Многократное переклеивание', 'Форма корпуса', 'Без запаха', 'Состав клея', 'Масса']",NULL,Клеи канцелярские,01.15.05.04.04,КЛЕИ КАНЦЕЛЯРСКИЕ,NULL,NULL
"Папка архивная складная ATTACHE,120 мм, красный","['Вид материала', 'Вместимость папки', 'Внешний размер', 'Внутренний размер', 'Застежка', 'Количество в упаковке', 'С гребешком', 'Тип конструкции', 'Цвет', 'Ширина корешка', 'Экотовар']",289.04,Папки картонные,01.15.03.16,ПАПКИ КАРТОННЫЕ,NULL,NULL
"Папка-регистратор Berlingo, 70мм, двусторонний бумвинил, с карманом на кор.,ниж. метал. кант, черная","['Вид продукции', 'Материал', 'Формат', 'Цвет', 'Ширина корешка', 'Вид товаров', 'Вид системы архивации']",NULL,Папки картонные,01.15.03.16,ПАПКИ КАРТОННЫЕ,NULL,NULL
Зажимы для бумаг «OFFICE LINE» 19мм черные 12шт,"['Вид упаковки', 'Количество скрепляемых листов:', 'Материал', 'Размер', 'ТМ/Бренд', 'Цвет']",NULL,Зажимы для бумаг,01.15.05.04.06.03,ЗАЖИМЫ ДЛЯ БУМАГ,NULL,NULL
Люверсы для дыроколов KW-Trio золотистые диаметр 4.8 мм (250 штук в упаковке),"['Артикул', 'Диаметр', 'Количество штук в упаковке', 'Материал']",406.30,Материалы расходные для дыроколов,01.15.05.02.05.04,МАТЕРИАЛЫ РАСХОДНЫЕ ДЛЯ ДЫРОКОЛОВ,NULL,NULL
"Плёнка для ламинирования А3 OfficeSpace 303*426мм, 150мкм, глянец, 100л/уп","['Вид товаров', 'Толщина пленки, мкм', 'Количество в упаковке', 'Размер', 'Тип пленки', 'Формат листа', 'Цвет']",NULL,Пленка для ламинирования,01.15.05.02.06.01.06,ПЛЕНКА ДЛЯ ЛАМИНИРОВАНИЯ,NULL,NULL
"Скобы №10  Berlingo , 1000 шт/уп","['Вид покрытия', 'Количество скоб в пачке', 'Материал скоб', 'Размер скоб', 'Торговая марка']",NULL,Скобы для степлеров,01.15.05.04.06.02,СКОБЫ ДЛЯ СТЕПЛЕРОВ,NULL,NULL
Точилка Attache двойная с контейнером,"['Вид материала корпуса', 'Диаметр затачиваемого карандаша', 'Количество отверстий', 'Металлический сердечник', 'Особенности', 'Цвет корпуса']",NULL,Точилки для карандашей,01.15.05.10,ТОЧИЛКИ ДЛЯ КАРАНДАШЕЙ,NULL,NULL
"Зажимы для бумаг ""OFFICE LINE"" 32мм черные 12шт","['Вид упаковки', 'Количество скрепляемых листов:', 'Материал', 'Размер', 'ТМ/Бренд', 'Цвет']",NULL,Зажимы для бумаг,01.15.05.04.06.03,ЗАЖИМЫ ДЛЯ БУМАГ,NULL,NULL
"Короб архивный на кнопке Attache 70 мм пластик,синий","['Вид материала', 'Страна происхождения', 'Ширина корешка', 'Вместимость']",346.00,Папки пластиковые,01.15.03.17.05,ПАПКИ ПЛАСТИКОВЫЕ,NULL,NULL
"Ножницы Attache 169 мм с пласт.прорезин. руч. Attache, цвет зеленый/черный","['Схема вложения', 'Материал', 'Форма лезвий', 'Страна производитель', 'Артикул']",NULL,Ножницы канцелярские,01.15.05.15,НОЖНИЦЫ КАНЦЕЛЯРСКИЕ,NULL,NULL
"Штамп самонаборный Colop, 76x37 мм, 7/9 строк, 43 знака, Printer C60-Set-F","['Вид материала оснастки штемпеля', 'Вид штемпеля', 'Максимальное количество знаков', 'Максимальное количество знаков в строке', 'Размер оттиска', 'Тип механизма', 'Форма корпуса штампа', 'Цвет корпуса', 'Число строк', 'Штемпель самонаборный']",NULL,Штемпели,01.15.06.07,ШТЕМПЕЛИ,NULL,NULL
Спрей для экранов ЖК мониторов ProMega Office,"['Вид товара', 'Количество в упаковке', 'Назначение', 'Наличие антибактериального компонента', 'Наличие антистатического компонента', 'Форма выпуска средства', 'Наличие отдушки', 'Торговая марка', 'Вид товаров', 'Объем']",NULL,Принадлежности для очистки оргтехники,01.15.05.19,ПРИНАДЛЕЖНОСТИ ДЛЯ ОЧИСТКИ ОРГТЕХНИКИ,NULL,NULL
Зажимы для бумаг «OFFICE LINE» 51мм черные 12шт,"['Вид упаковки', 'Количество скрепляемых листов:', 'Материал', 'Размер', 'ТМ/Бренд', 'Цвет']",NULL,Зажимы для бумаг,01.15.05.04.06.03,ЗАЖИМЫ ДЛЯ БУМАГ,NULL,NULL
"Блок самоклеящийся 75х75 мм, зеленый, 100 листов, 75г/м, OFFICE LINE","['Бренд', 'Количество листов', 'Количество цветов', 'Размер изделия', 'Плотность бумаги', 'Количество в упаковке', 'Цвет', 'Вид товаров']",NULL,Блоки бумажные для записей,01.15.01.07,БЛОКИ БУМАЖНЫЕ ДЛЯ ЗАПИСЕЙ,NULL,NULL
"Блок бумажный, 90х90х50 мм, белый, офсет, в термопленке Workmate","['Белизна', 'Бренд', 'Количество листов в блоке', 'Наличие пластикового бокса', 'Плотность бумаги', 'Размер блока', 'Склейка', 'Цвет', 'Наличие термополенки', 'Вид товаров']",NULL,Блоки бумажные для записей,01.15.01.07,БЛОКИ БУМАЖНЫЕ ДЛЯ ЗАПИСЕЙ,NULL,NULL
Дырокол Kw-trio для люверсов на 30 л. серебристый,"['Особенности', 'Гарантийный срок', 'Схема вложения', 'Количество пробиваемых отверстий', 'Количество пробиваемых листов', 'Диаметр пробиваемого отверстия', 'Расстояние от края листа до центра отверстия']",1317.00,Дыроколы для люверсов,01.15.05.02.05.02,ДЫРОКОЛЫ ДЛЯ ЛЮВЕРСОВ,NULL,NULL
Образовательных услуг по дополнительным профессиональным программам повышения квалификации в области современных методов управления данными и моделирования бизнес-процессов,"['Вид документа, выдаваемого по результатам обучения', 'Вид обучения', 'Количество слушателей , диапазон', 'Объем образовательных программ в диапазоне', 'Условия оплаты']",NULL,Повышение профессиональной квалификации,03.03.14.01,ПОВЫШЕНИЕ ПРОФЕССИОНАЛЬНОЙ КВАЛИФИКАЦИИ,NULL,NULL
"Техническое обслуживание, содержание и текущий ремонт оборудования.","['Выезд на объект', 'Осмотр оборудования', 'Диагностика оборудования', 'Устранение неисправности', 'Замена запчастей', 'Разборка  оборудования', 'Сборка оборудования', 'Пусконаладочные работы', 'Тестирование оборудования', 'Ввод оборудования в эксплуатацию']",NULL,Обслуживание техническое и текущий ремонт технологического оборудования,03.07.06,ОБСЛУЖИВАНИЕ ТЕХНИЧЕСКОЕ И ТЕКУЩИЙ РЕМОНТ ТЕХНОЛОГИЧЕСКОГО ОБОРУДОВАНИЯ,NULL,NULL
Принтер Zebra GK420T,"['Рекомендуемый объём печати в день', 'Максимальная длина печати', 'Ширина этикетки', 'Диаметр рулона этикеток', 'Ширина красящей ленты (риббона)', 'Языки управления принтером', 'Отрезчик', 'Отделитель', 'Намотчик', 'Метод печати', 'Ширина', 'Высота', 'Длина', 'Вес', 'Максимальная ширина печати', 'Интерфейсы подключения', 'Оперативная память']",NULL,Принтеры специализированные,01.13.04.02.01.12,ПРИНТЕРЫ СПЕЦИАЛИЗИРОВАННЫЕ,NULL,NULL
"Уничтожитель документов HSM Shredstar X5 бел, 4ур.секр., 6лист, 18л","['Автоматическое управление', 'Автоподача бумаги', 'Вес', 'Выдвижная корзина', 'Габариты', 'Гарантийный срок', 'Количество уничтожаемых листов', 'Комплектуется колесиками', 'Мощность двигателя', 'Уровень секретности (DIN 66399)', 'Уничтожение компакт-дисков', 'Уничтожение дискет', 'Уничтожение кредитных карт', 'Уровень шума', 'Размер фрагмента', 'Объем приемной корзины', 'Ширина приемника', 'Скорость', 'Тип резки', 'Уничтожение канцелярских скрепок', 'Уничтожение  степлерных скоб', 'Рекомендуемое количество пользователей']",10326.00,Устройства офисные для уничтожения документов,01.13.11.01.05,УСТРОЙСТВА ОФИСНЫЕ ДЛЯ УНИЧТОЖЕНИЯ ДОКУМЕНТОВ,12017,"Шредер, секретность 1"
"Риббон RESIN, 110 мм х 74 м, втулка диаметр 12,7 мм (0,5 дюйма) х ширина 110 мм, красящий слой наружу (OUT)","['Вес', 'Диаметр', 'Длина', 'Препринт', 'Рулонов в упаковке', 'Страна производитель', 'Тип ленты', 'Ценовая категория', 'Ширина ленты']",NULL,"Расходные материалы и комплектующие для принтеров, печатающих не на бумаге",01.13.13.01.04,"РАСХОДНЫЕ МАТЕРИАЛЫ И КОМПЛЕКТУЮЩИЕ ДЛЯ ПРИНТЕРОВ, ПЕЧАТАЮЩИХ НЕ НА БУМАГЕ",NULL,NULL
Уничтожитель документов HSM Shredstar S10 (6 мм) White,"['Уровень секретности (DIN 66399)', 'Объем приемной корзины', 'Размер частиц', 'Количество уничтожаемых листов']",NULL,Устройства офисные для уничтожения документов,01.13.11.01.05,УСТРОЙСТВА ОФИСНЫЕ ДЛЯ УНИЧТОЖЕНИЯ ДОКУМЕНТОВ,NULL,NULL
Брошюровщик Gladwork Business CB-25D,"['Вес', 'Габаритные размеры', 'Гарантийный срок', 'Количество пробиваемых листов за один раз (максимиум)', 'Макс. диаметр пружины', 'Тип переплета']",19644.00,Машины брошюровочные и переплетные,01.13.11.01.03,МАШИНЫ БРОШЮРОВОЧНЫЕ И ПЕРЕПЛЕТНЫЕ,39150,"Термоброшюровщик, размер переплетаемого документа до 340стр., система сжатия до 120стр."
Выполнение работ по монтажу и пуск-наладке системы контроля и управления доступом,"['Актуализация и программирование бд скуд гостевых пропусков (эра)', 'Ввод в эксплуатацию', 'Замена считывающего устройства карт доступа (материал подрядчика)', 'Затягивание проводов', 'Интеграция в существующее программное обеспечение', 'Количество считывателей', 'Контроллер', 'Монтаж автоматики', 'Вид работ']",NULL,Монтаж оборудования систем охранной сигнализации,02.12.03.09,МОНТАЖ ОБОРУДОВАНИЯ СИСТЕМ ОХРАННОЙ СИГНАЛИЗАЦИИ,NULL,NULL
Перчатки защитные полиэтиленовые,"['Виды одежды (включая форменную), головных уборов, одежды специальной', 'Вид продукции', 'Виды одежды специальной', 'Вид средств защиты рук', 'Вид товаров', 'Вид внутреннего покрытия', 'Материал перчаток', 'Стерильность', 'Цвет', 'Минимальная длина перчатки']",NULL,Перчатки из полимерных материалов для защиты от внешних воздействий,01.19.10.17.01,ПЕРЧАТКИ ИЗ ПОЛИМЕРНЫХ МАТЕРИАЛОВ ДЛЯ ЗАЩИТЫ ОТ ВНЕШНИХ ВОЗДЕЙСТВИЙ,NULL,NULL
Оказание услуг по оцифровке документов,"['Оцифровка документов, содержащих буквенные и текстовые символы на русском или английском языке', 'Оцифровка посуточных ведомостей общедомовых приборов учета коммунального ресурса', 'Оцифровка документов не более, чем по 170 приборам учета', 'Оцифровка документов за 3 календарных года', 'Вид продукции']",NULL,Услуги по оцифровке документов,03.24.01.03,УСЛУГИ ПО ОЦИФРОВКЕ ДОКУМЕНТОВ,NULL,NULL
"ДОКУМЕНТАРНОЕ ОБЕСПЕЧЕНИЕ, ДЕЛОПРОИЗВОДСТВО","['Выборка документов', 'Информировать о ходе оказания услуг', 'Настоящий договор вступает в силу с даты подписания его сторонами', 'Обеспечивает рабочее место руководителя необходимыми средствами организационной техники, канцелярскими принадлежностями, создает условия, способствующие эффективной работе руководителя.', 'Разбор документов', 'Вид продукции', 'Вид услуги', 'Тип услуги']",NULL,"Документарное обеспечение, делопроизводство",03.24.02,"ДОКУМЕНТАРНОЕ ОБЕСПЕЧЕНИЕ, ДЕЛОПРОИЗВОДСТВО",NULL,NULL
"Доступ к системе ""Мой Интегрум""","['Вид услуги', 'Возможности работы с данными', 'Информационная поддержка по электронной почте', 'Количество доступов', 'Количество логинов на каждый экземпляр', 'Круглосуточный доступ', 'Сбор и анализ информации', 'Сбор статистики', 'Вид консалтинговых услуг', 'Сбор и анализ (обработка) сведений']",NULL,Услуги по предоставлению доступа к On-Line версии справочно-правовой системы,03.13.11.01.01,УСЛУГИ ПО ПРЕДОСТАВЛЕНИЮ ДОСТУПА К ON-LINE ВЕРСИИ СПРАВОЧНО-ПРАВОВОЙ СИСТЕМЫ,NULL,NULL
Выполнение работ по изготовлению печатей и штампов,"['Изготовление макета', 'Корпус', 'Метод изготовления', 'Оснастка', 'Цвет краски', 'Вид работ']",NULL,Изготовление штампов,02.17.06.02,ИЗГОТОВЛЕНИЕ ШТАМПОВ,NULL,NULL
Изготовление легких офисных перегородок,"['Вид изделия', 'Вид материала каркаса', 'Габаритные размеры', 'Цвет', 'Количество колесных опор', 'Вид работ']",NULL,Изготовление изделий из комбинации различных материалов...,02.17.01.99,ИЗГОТОВЛЕНИЕ ИЗДЕЛИЙ ИЗ КОМБИНАЦИИ РАЗЛИЧНЫХ МАТЕРИАЛОВ,NULL,NULL
Образовательные услуги по дополнительным профессиональным программам повышения квалификации по сетевым технологиям Cisco и Microsoft,"['Вид выдаваемого документа', 'Вид обучения', 'Выдача документа о прохождении обучения', 'Дневная форма обучения', 'Количество академических часов', 'Место проведения обучения', 'Длительность курса']",NULL,Дополнительное обучение,03.03.14.05,ДОПОЛНИТЕЛЬНОЕ ОБУЧЕНИЕ,NULL,NULL
Информационно-консультационные услуги по работе с психометрическими инструментами,"['Количество участников', 'Место оказания услуг', 'Продолжительность', 'Продолжительность мероприятия', 'Результат', 'Форма проведения']",NULL,Иные учебные мероприятия,03.03.99,ИНЫЕ УЧЕБНЫЕ МЕРОПРИЯТИЯ,NULL,NULL
"Обучение по курсу ""Компьютерная криминалистика""","['Категория слушателей', 'Количество дней обучения', 'Наименование дополнительной образовательной программы', 'Объем учебной программы в часах', 'Результат обучения', 'Форма обучения']",NULL,Дополнительное обучение,03.03.14.05,ДОПОЛНИТЕЛЬНОЕ ОБУЧЕНИЕ,NULL,NULL
Профессиональная программа повышения квалификации по тематике «Введение в BI»,"['Вид обучения', 'Наличие условий для обучения маломобильных групп граждан', 'Объем образовательной программы', 'Порядок обучения для государственных гражданских служащих (муниципальных служащих)', 'Применение дистанционных технологий обучения', 'Применение электронного обучения']",NULL,Повышение профессиональной квалификации,03.03.14.01,ПОВЫШЕНИЕ ПРОФЕССИОНАЛЬНОЙ КВАЛИФИКАЦИИ,NULL,NULL
Оформление подписки,"['Вид изданий', 'Вид услуги', 'Услуги связи и телекоммуникации']",NULL,Услуги почтовой связи,03.12.05.01,УСЛУГИ ПОЧТОВОЙ СВЯЗИ,NULL,NULL
Услуги по предоставлению доступа к справочно-правовой системе,"['Адаптация (установка, тестирование, регистрация, формирование в комплекты, выполнение других настроек)', 'Передача актуальной информации (актуальных наборов текстовой информации, адаптированных к имеющимся у заказчика экземплярам систем)', 'Технологическая профилактика работоспособности системы', 'Восстановление работоспособности системы']",NULL,Услуги по предоставлению доступа к локальной версии справочно-правовой системы,03.13.11.01.02,УСЛУГИ ПО ПРЕДОСТАВЛЕНИЮ ДОСТУПА К ЛОКАЛЬНОЙ ВЕРСИИ СПРАВОЧНО-ПРАВОВОЙ СИСТЕМЫ,NULL,NULL
Выполнение работ по изготовлению экранов фронтальных для рабочих столов,"['Материал кромки', 'Материал основания', 'Особенность', 'Страна происхождения', 'Толщина кромки каркаса', 'Внутреннее наполнение тканевых накладок', 'Габаритные размеры тканевых накладок (шхв)', 'Габаритные размеры экрана фронтального (шхгхв)', 'Количество тканевых накладок', 'Вид работ', 'Цвет лдсп', 'Способ крепления тканевых накладок', 'Цвет тканевых накладок', 'Способ крепления экрана']",NULL,Изготовление изделий из комбинации различных материалов...,02.17.01.99,ИЗГОТОВЛЕНИЕ ИЗДЕЛИЙ ИЗ КОМБИНАЦИИ РАЗЛИЧНЫХ МАТЕРИАЛОВ,NULL,NULL
Физическая охрана,"['Обеспечение внутриобъектового и пропускного режимов на объектах', 'Суточный пост', 'Услуги физической охраны', 'Защита жизни и здоровья граждан']",NULL,Услуги частной охраны (выставление поста охраны),03.10.01.01,УСЛУГИ ЧАСТНОЙ ОХРАНЫ (ВЫСТАВЛЕНИЕ ПОСТА ОХРАНЫ),NULL,NULL
Оказание образовательных услуг по дополнительным профессиональным программам повышения квалификации в области объектно-ориентированного программирования и администрирования ОС,"['Вид образовательной услуги', 'Выдача удостоверения о повышении квалификации', 'Категория обучающихся', 'Наименование дополнительных образовательных программ', 'Повышение квалификации', 'Форма обучения']",NULL,Дополнительное обучение,03.03.14.05,ДОПОЛНИТЕЛЬНОЕ ОБУЧЕНИЕ,NULL,NULL
Оказание Образовательных услуг по дополнительным профессиональным программам повышения квалификации по сетевым технологиям хранения данных,"['Вид обучения', 'Объем образовательной программы', 'Предоставление помещения для обучения Исполнителем', 'Применение дистанционных технологий обучения', 'Применение электронного обучения', 'Требование к месту проведения обучения', 'Форма обучения']",NULL,Повышение профессиональной квалификации,03.03.14.01,ПОВЫШЕНИЕ ПРОФЕССИОНАЛЬНОЙ КВАЛИФИКАЦИИ,NULL,NULL
