Name,Params,Price,Category,KPGZ Code,KPGZ,SPGZ Code,SPGZ
Нормы и правила работы в электроустановках потребителей энергии (до 1000В),"['Категория слушателей программы', 'Количество человек в диапазоне', 'Наименование программы повышения квалификации', 'Срок обучения', 'Учебная программа, объем', 'Форма обучения', 'Цель  обучения']",8250.00,Повышение профессиональной квалификации,03.03.14.01,ПОВЫШЕНИЕ ПРОФЕССИОНАЛЬНОЙ КВАЛИФИКАЦИИ,NULL,NULL
"Обучение по программе ""Пожарная безопасность для руководителей организаций, лиц, назначенных руководителем организации ответственными за обеспечение пожарной безопасности, в том числе в обособленных структурных подразделениях организации""","['Вид обучения', 'Категория обучающихся', 'Наличие условий для обучения маломобильных групп граждан', 'Объем образовательной программы', 'Предоставление помещения для обучения Исполнителем', 'Применение дистанционных технологий обучения', 'Применение электронного обучения', 'Требование к месту проведения обучения', 'Форма обучения', 'Вид продукции', 'Вид услуги', 'Вид образовательных, научных услуг', 'Виды профессионального образования по дополнительным профессиональным образовательным программам']",NULL,Повышение профессиональной квалификации,03.03.14.01,ПОВЫШЕНИЕ ПРОФЕССИОНАЛЬНОЙ КВАЛИФИКАЦИИ,NULL,NULL
"Обучение по программе ""Пожарная безопасность для лиц, на которых возложена трудовая функция по проведению противопожарного инструктажа""","['Вид обучения', 'Категория обучающихся', 'Наличие условий для обучения маломобильных групп граждан', 'Объем образовательной программы', 'Предоставление помещения для обучения Исполнителем', 'Применение дистанционных технологий обучения', 'Применение электронного обучения', 'Требование к месту проведения обучения', 'Форма обучения', 'Вид продукции', 'Вид услуги', 'Вид образовательных, научных услуг', 'Виды профессионального образования по дополнительным профессиональным образовательным программам']",NULL,Повышение профессиональной квалификации,03.03.14.01,ПОВЫШЕНИЕ ПРОФЕССИОНАЛЬНОЙ КВАЛИФИКАЦИИ,NULL,NULL
"Курсы повышения квалификации ""Нормы и правила работы в электроустановках потребителей энергии""","['Аудитория', 'Вид выдаваемого документа', 'Вид обучения', 'Возможен выезд преподавателя в вашу организацию', 'Категория обучающихся', 'Наличие условий для обучения маломобильных групп граждан', 'Объем образовательной программы', 'Предоставление помещения для обучения Исполнителем', 'Применение дистанционных технологий обучения', 'Вид продукции', 'Вид услуги', 'Вид образовательных, научных услуг', 'Виды профессионального образования по дополнительным профессиональным образовательным программам', 'Форма обучения', 'Требование к месту проведения обучения']",NULL,Повышение профессиональной квалификации,03.03.14.01,ПОВЫШЕНИЕ ПРОФЕССИОНАЛЬНОЙ КВАЛИФИКАЦИИ,NULL,NULL
"Обучение по программе ""Охрана труда""","['Вид обучения', 'Выдаваемый документ по окончании обучения', 'Категория обучающихся', 'Объем образовательной программы', 'Применение дистанционных технологий обучения', 'Применение электронного обучения', 'Форма обучения']",NULL,Повышение профессиональной квалификации,03.03.14.01,ПОВЫШЕНИЕ ПРОФЕССИОНАЛЬНОЙ КВАЛИФИКАЦИИ,NULL,NULL
"Обучение по программе ""Нормы и правила работы в электроустановках потребителей энергии""","['Вид обучения', 'Категория обучающихся', 'Наличие условий для обучения маломобильных групп граждан', 'Объем образовательной программы', 'Предоставление помещения для обучения Исполнителем', 'Применение дистанционных технологий обучения', 'Применение электронного обучения', 'Требование к месту проведения обучения', 'Форма обучения', 'Вид продукции', 'Вид услуги', 'Вид образовательных, научных услуг', 'Виды профессионального образования по дополнительным профессиональным образовательным программам']",NULL,Повышение профессиональной квалификации,03.03.14.01,ПОВЫШЕНИЕ ПРОФЕССИОНАЛЬНОЙ КВАЛИФИКАЦИИ,NULL,NULL
"Повышение квалификации по программе ""Digital-трансформация: как сделать бизнес цифровым""","['Вид обучения', 'Категория обучающихся', 'Объем образовательной программы', 'Форма обучения', 'Вид продукции', 'Вид услуги', 'Вид образовательных, научных услуг', 'Виды профессионального образования по дополнительным профессиональным образовательным программам']",NULL,Повышение профессиональной квалификации,03.03.14.01,ПОВЫШЕНИЕ ПРОФЕССИОНАЛЬНОЙ КВАЛИФИКАЦИИ,14269585,"Обучение по образовательным программам (повышение квалификации) для специалистов организаций (учреждений, предприятий)"
Услуги по хранению оборудования с последующей утилизацией,"['Демонтаж', 'Место хранения', 'Наличие специальной лицензии', 'Отапливаемый склад', 'Погрузочно-разгрузочное оборудование', 'Утилизация']",60000.00,Услуги по складированию и хранению имущества,03.20.07,УСЛУГИ ПО СКЛАДИРОВАНИЮ И ХРАНЕНИЮ ИМУЩЕСТВА,NULL,NULL
"Степлер №10 BRAUBERG «Extra», до 20 листов, антистеплер, черно-красный","['Глубина закладки бумаги', 'Для скоб размером', 'Количество пробиваемых листов:', 'Наличие антистеплера', 'Основной цвет корпуса', 'Упаковка']",214.98,Степлеры (сшиватели),01.15.05.02.01,СТЕПЛЕРЫ (СШИВАТЕЛИ),NULL,NULL
"Разделители листов (полосы 230х105 мм) картонные, КОМПЛЕКТ 100 штук, желтые, BRAUBERG","['Вид товаров', 'Для папок формата', 'Количество в упaковке', 'Материал', 'Тип сортировки', 'Форма']",NULL,Разделители листов картонные,01.15.05.04.07.01,РАЗДЕЛИТЕЛИ ЛИСТОВ КАРТОННЫЕ,NULL,NULL
"Тубус Стамм на ремне 64362 (длина 63-110 см, диаметр 9 см, черный)","['Вид материала', 'Диаметр ', 'Плечевой ремень', 'Предназначен', 'Цвет', 'Высота', 'Количество частей тубуса']",595.69,Принадлежности чертежные,01.15.07.04,ПРИНАДЛЕЖНОСТИ ЧЕРТЕЖНЫЕ,NULL,NULL
"Скобы для степлера BRAUBERG, №23/13, 1000 штук, до 80 листов","['Вид покрытия', 'Количество скоб в пачке', 'Максимальное количество сшиваемых листов', 'Масса', 'Материал скоб', 'Тип и размер скоб', 'Упаковка', 'Цвет скоб']",214.66,Скобы для степлеров,01.15.05.04.06.02,СКОБЫ ДЛЯ СТЕПЛЕРОВ,NULL,NULL
"Обложки для переплета Office Kit пластиковые, красные, А4, 200 мкм, 100 шт/упак","['Количество в упаковке', 'Материал', 'Текстура материала', 'Тип переплета', 'Формат', 'Цвет', 'Вид товаров']",NULL,Обложки для переплета пластиковые,01.15.05.02.06.01.02,ОБЛОЖКИ ДЛЯ ПЕРЕПЛЕТА ПЛАСТИКОВЫЕ,NULL,NULL
"Точилка BRAUBERG «Drum Dual», 2 отверстия для чернографитных карандашей (в том числе утолщенных), с контейнером, 228436","['Вид материала корпуса', 'Возможность выбора цвета', 'Высота', ' Глубина ', 'Количество отверстий', 'Наличие контейнера для стружки', 'Подходит для левшей', 'Специальная  заточка утолщенных карандашей', 'Упаковка ', 'Форма корпуса', 'Ширина', 'Цвет корпуса']",NULL,Точилки для карандашей,01.15.05.10,ТОЧИЛКИ ДЛЯ КАРАНДАШЕЙ,NULL,NULL
Чистящая жидкость-спрей BRAUBERG для маркерных досок,"['Антистатический эффект', 'Масса', 'Объем очистителя', 'С ароматизатором']",165.12,Очистители для маркерных досок,01.15.05.03.04.06,ОЧИСТИТЕЛИ ДЛЯ МАРКЕРНЫХ ДОСОК,NULL,NULL
Краска штемпельная Attache красная 50 г,"['Объем', 'Специальная штемпельная краска', 'Схема вложения', 'Цвет штемпельной краски']",59.51,Средства красящие канцелярские,01.15.05.04.03.04,СРЕДСТВА КРАСЯЩИЕ КАНЦЕЛЯРСКИЕ,NULL,NULL
"Маркер Выделитель текста CC2118S зеленый 1-3,9мм.","['Максимальная толщина линии письма', 'Минимальная толщина линии письма', 'Стираемый', 'Схема вложения', 'Цвет чернил']",22.58,Маркеры,01.15.04.02.04,МАРКЕРЫ,NULL,NULL
"Разделители листов (полосы 230*105 мм) картонные, КОМПЛЕКТ 100 штук, зеленые, BRAUBERG, 223971","['Длина', 'Для папок формата', 'Материал', 'Плотность, г/м2', 'Тип сортировки', 'Универсальная перфорация для всех типов папок', 'Форма', 'Ширина', 'Цвет']",261.05,Разделители листов картонные,01.15.05.04.07.01,РАЗДЕЛИТЕЛИ ЛИСТОВ КАРТОННЫЕ,NULL,NULL
"Ручка-роллер UNI-BALL (Япония) ""Vision Elite"", корпус серый, узел 0,8 мм, линия 0,6 мм, синяя","['Автоматическая', 'Диаметр пишущего узла', 'Длина стержня', 'Индикатор остатка чернил', 'Количество в наборе', 'Масса', 'Одноразовая', 'Толщина линии письма', 'Упаковка', 'Форма наконечника', 'Форма корпуса', 'Чернила на водной основе']",NULL,Ручки канцелярские,01.15.04.01.01,РУЧКИ КАНЦЕЛЯРСКИЕ,24488720,Ручка канцелярская
"Ластик серо-белый, натуральный каучук,  BRAUBERG «Ultra», 41х14х8 мм, 228703","['Вид удаляемой надписи', 'Высота', 'Длина', 'Количество в наборе', 'Материал изготовления', 'Не оставляет бумажной пыли', 'Упаковка', 'Форма', 'Цвет ластика', 'Ширина']",19.74,Ластики,01.15.04.07,ЛАСТИКИ,NULL,NULL
"Корректирующая жидкость STAFF, 20 мл, с кисточкой, на водной основе","['Тип жидкости', 'Бренд', 'Вес', 'Вид нанесения', 'Объем']",40.01,Средства корректирующие канцелярские,01.15.05.04.03.01,СРЕДСТВА КОРРЕКТИРУЮЩИЕ КАНЦЕЛЯРСКИЕ,NULL,NULL
"Пружины для переплета OFFICE KIT пластиковые 8мм, красный, 100шт/уп","['Диаметр пружины', 'Количество в упаковке', 'Максимальное количество переплетаемых листов', 'Материал', 'Тип', 'Формат', 'Цвет', 'Вид товаров']",NULL,Пружины для переплета пластиковые,01.15.05.02.06.01.01,ПРУЖИНЫ ДЛЯ ПЕРЕПЛЕТА ПЛАСТИКОВЫЕ,NULL,NULL
"Портфель пластиковый BRAUBERG портфолио, А3, 470х380х130 мм, 3 отделения, на молнии, черный","['Формат', 'Масса']",NULL,Папки пластиковые,01.15.03.17.05,ПАПКИ ПЛАСТИКОВЫЕ,NULL,NULL
"Клей силикатный WORKMATE, 110 гр, с дозатором","[' Вес', 'Вид аппликатора', 'Морозостойкость', 'Назначение', 'Основа', 'Цветовой пигмент']",NULL,Клеи канцелярские,01.15.05.04.04,КЛЕИ КАНЦЕЛЯРСКИЕ,NULL,NULL
"Портфель пластиковый BRAUBERG, премьер, А4, 390х315х120 мм, 3 отделения, на молнии, черный","['Цвет', 'Формат', 'Вид материала', 'Фактура', 'Количество карманов', 'Масса', 'Тип товара', 'Застежка', 'Индексные ярлычки', 'Ширина', 'Тканевая окантовка', 'Глубина', 'Тип ручки', 'Высота', 'Количество отделений', 'Плечевой ремень', 'Металлические рейки по краям окантовки']",1406.35,Папки пластиковые,01.15.03.17.05,ПАПКИ ПЛАСТИКОВЫЕ,NULL,NULL
Подставка для канцелярских мелочей Attache Авангард 5 отделений черный,"['Вид материала', 'Вращающийся', 'Количество отделений', 'Количество штук в транспортном коробе', 'Размер изделия', 'Цвет']",227.58,Подставки для канцелярских принадлежностей пластиковые,01.15.05.01.05.01.01,ПОДСТАВКИ ДЛЯ КАНЦЕЛЯРСКИХ ПРИНАДЛЕЖНОСТЕЙ ПЛАСТИКОВЫЕ,27280247,Подставка для канцелярских принадлежностей настольная (органайзер) пластиковая
"Книга учета движения трудовых книжек и вкладышей к ним, 48 л., А4, 210х290 мм, картон, офсет","['Вес', 'Вид книги', 'Внутренний блок', 'Длина', 'Количество листов', 'Назначение', 'Нумерация страниц', 'Обложка журнала', 'Оглавление', 'Плотность внутреннего блока', 'Ориентация', 'Цвет обложки', 'Ширина', 'Плотность обложки', 'Формат', 'Тип скрепления', 'Прошнурован']",96.51,Журналы (книги) регистрации и учета специализированные,01.15.02.05.03,ЖУРНАЛЫ (КНИГИ) РЕГИСТРАЦИИ И УЧЕТА СПЕЦИАЛИЗИРОВАННЫЕ,NULL,NULL
"Маркеры стираемые для белой доски НАБОР 4 ЦВЕТА, BRAUBERG ""CLASSIC"", 3 мм, с клипом, 152117","['Диапазон толщины линии письма', 'Количество в наборе', 'Цвет', 'Серия', 'Основа чернил', 'Устойчив к засыханию', 'Чернила стираются сухой губкой', 'Не протекает при перепаде давления', 'Наличие клипа на колпачке', 'Материал корпуса']",286.38,Маркеры,01.15.04.02.04,МАРКЕРЫ,NULL,NULL
"Степлер KW-trio мощный №23/6 - 23/13, на 100 листов, серый/черный","['Количество пробиваемых листов', 'Вес']",1993.95,Степлеры (сшиватели),01.15.05.02.01,СТЕПЛЕРЫ (СШИВАТЕЛИ),NULL,NULL
Краска штемпельная Attache черная на водной основе 50 г,"['Объем/вес', 'Состав штемпельной краски', 'Специальная штемпельная краска', 'Схема вложения', 'Цвет штемпельной краски']",59.51,Средства красящие канцелярские,01.15.05.04.03.04,СРЕДСТВА КРАСЯЩИЕ КАНЦЕЛЯРСКИЕ,NULL,NULL
Калькулятор настольный ПОЛНОРАЗМЕРНЫЙ Citizen BusinessLine CDB1601-BK 16-разрядный черный,"['Вычисление квадратного корня', ' Гарантийный срок', 'Размеры (дхшхв)', 'Строчность дисплея калькулятора', 'Тип калькулятора', 'Тип питания', 'Тип размера', 'Масса', 'Разрядность дисплея калькулятора']",NULL,Калькуляторы,01.15.05.08,КАЛЬКУЛЯТОРЫ,NULL,NULL
Клей-карандаш ErichKrause 15 г,"[' Вес', 'Назначение', 'Наличие цветового пигмента', 'Описание', 'Основа']",77.36,Клеи канцелярские,01.15.05.04.04,КЛЕИ КАНЦЕЛЯРСКИЕ,NULL,NULL
"Блокнот А5 (146х205 мм), 80 л., гребень, картон, жесткая подложка, клетка, BRAUBERG, «Стильный», 129818","['Вид линовки', 'Вид товара', 'Длина', 'Количество листов', 'Материал обложки', 'Плотность бумаги, г/кв.м', 'Тип крепления', 'Формат листа', 'Цвет обложки', 'Ширина']",100.71,Блокноты,01.15.02.01,БЛОКНОТЫ,NULL,NULL
"Ручка гелевая CROWN «Hi-Jell» цвет чернил зеленый, цвет корпуса прозрачный","['Диаметр пишущего узла', 'Длина стержня', 'Количество в наборе', 'Толщина линии письма', 'Упаковка', 'Форма корпуса', 'Форма наконечника', 'Цвет корпуса', 'Цвет чернил']",NULL,Ручки канцелярские,01.15.04.01.01,РУЧКИ КАНЦЕЛЯРСКИЕ,NULL,NULL
Штамп самонаборный Colop Printer C20-Set пластиковый 4 строки,"['Вид материала оснастки штемпеля', 'Вид штемпеля', 'Количество строк', 'Максимальное количество знаков', 'Максимальное количество знаков в строке', 'Размер оттиска', 'Вид товаров']",1179.11,Штемпели,01.15.06.07,ШТЕМПЕЛИ,NULL,NULL
"Блок самоклеящийся (стикеры) BRAUBERG, ПАСТЕЛЬНЫЙ, 76?76 мм, 100 листов, желтый","['Z - укладка листочков', 'Вес', 'Длина', 'Закладки в комплекте', 'Клейкость', 'Количество блоков', 'Количество листов в блоке', 'Количество цветов', 'Плотность бумаги', 'Четырехцветная печать по бокам блока', 'Упаковка', 'Форма', 'Тон', 'Специальное отверстие для ручки', 'Ширина']",51.01,Блоки бумажные для записей,01.15.01.07,БЛОКИ БУМАЖНЫЕ ДЛЯ ЗАПИСЕЙ,NULL,NULL
"Разделители листов (полосы 230х105 мм) картонные, КОМПЛЕКТ 100 штук, голубые, BRAUBERG, 223973","['Длина', 'Для папок формата', 'Материал', 'Тип сортировки', 'Форма', 'Цвет', 'Ширина', 'Вид товаров']",261.89,Разделители листов картонные,01.15.05.04.07.01,РАЗДЕЛИТЕЛИ ЛИСТОВ КАРТОННЫЕ,NULL,NULL
"Ручка гелевая CROWN «Hi-Jell» цвет чернил красный, цвет корпуса прозрачный","['Диаметр пишущего узла', 'Длина сменного стержня', 'Количество в наборе', 'Толщина линии письма', 'Форма корпуса', 'Форма наконечника', 'Цвет корпуса', 'Цвет чернил', 'Эргономичная зона захвата']",NULL,Ручки канцелярские,01.15.04.01.01,РУЧКИ КАНЦЕЛЯРСКИЕ,NULL,NULL
"Скобы для степлера №23/8, 1000 штук, BRAUBERG, от 10 до 40 листов","['Количество в упаковке, max', 'Максимальное количество сшиваемых листов', 'Материал скоб', 'Размер скоб', 'Скобы для степлера электрического', 'Тип покрытия скоб', 'Упаковка', 'Цвет скоб']",NULL,Скобы для степлеров,01.15.05.04.06.02,СКОБЫ ДЛЯ СТЕПЛЕРОВ,NULL,NULL
"Короб архивный на кнопке Attache 70 мм пластик,синий","['Вид материала', 'Страна происхождения', 'Ширина корешка', 'Вместимость']",346.00,Папки пластиковые,01.15.03.17.05,ПАПКИ ПЛАСТИКОВЫЕ,NULL,NULL
"Ручка шариковая Workmate цвет чернил синий, цвет корпуса прозрачный","[' Тип упаковки', 'Вид материала корпуса', 'Возможность замены пишущего стержня', 'Диаметр шарика', 'Количество в наборе', 'Наличие резинового держателя', 'Ручка автоматическая', 'Толщина линии письма', 'Форма корпуса', 'Цвет чернил', 'Форма наконечника', 'Чернила на масляной основе', 'Цвет корпуса']",NULL,Ручки канцелярские,01.15.04.01.01,РУЧКИ КАНЦЕЛЯРСКИЕ,24488720,Ручка канцелярская
